{
    "$schema": "http://json-schema.org/draft-07/schema#",
    "title": "Skill",
    "type": "object",
    "required": [
        "id",
        "name",
        "type",
        "typeGroup",
        "prereq",
        "effect"
    ],
    "properties": {
        "id": {
            "type": "string",
            "description": "Stable mechanical ID (e.g. skill.action.drawback)"
        },

        "name": { 
            "type": "string",
            "description": "The name of the skill"
        },

        "type": {
            "type": "string",
            "enum": ["technique", "action", "strategy", "reflex", "passive"],
            "description": "The type of skill (e.g. 'technique', 'action', etc.)"
        },

        "typeGroup": {
            "type": "string",
            "enum": ["sword, lance, and axe", "dagger and bow", "anima, light, and dark", "staff", "strike, talons, and breath", "shifting stone", "fiend", "all-access", "infantry", "cavalry", "flier", "armor", "combat"],
            "description": "The weapon type group this skill is associated with, or 'none' if not applicable"
        },

        "prereq": {
            "type": "array",
            "items": {
                "type": "string"
            },
            "default": [],
            "description": "Prerequisites to learn this skill"
        },

        "requiredCharge": {
            "type": "string",
            "description": "How many charges are required to activate this skill. (Only Combat Arts need charges.)"
        },

        "effect": {
            "type": "string",
            "description": "Description of the skill's effect"
        }, 

        "statBonuses": {
            "type": "object",
            "additionalProperties": false,
            "properties": {
                "hp": { "type": "number" },
                "atk": { "type": "number" },
                "def": { "type": "number" },
                "luck": { "type": "number" },
                "spd": { "type": "number" },
                "dex": { "type": "number" },
                "res": { "type": "number" },
                "hit": { "type": "number" },
                "mov": { "type": "number" },
                "avoid": { "type": "number" },
                "transformGauge": { "type": "number" }
            }        
        },

        "tags": {
            "type": "array",
            "items": { "type": "string" },
            "default": []
        }
    }
}