[
  {
    "id": "skill.draw-back",
    "name": "Draw Back",
    "type": "action",
    "typeGroup": "all-access",
    "prereq": [],
    "effect": "The user moves themself and an adjacent ally back 1 space.",
    "tags": [
      "movement:self",
      "movement:ally",
      "target:adjacentAlly"
    ]
  },
  {
    "id": "skill.obstruct",
    "name": "Obstruct",
    "type": "passive",
    "typeGroup": "all-access",
    "prereq": [],
    "effect": "When user has 1/2 or more HP, any opponent that moves onto a space adjacent to the user immediately ends their movement.",
    "tags": [
      "condition:hp>=50%",
      "effect:endMovement",
      "target:enemyAdjacent"
    ]
  },
  {
    "id": "skill.pass",
    "name": "Pass",
    "type": "passive",
    "typeGroup": "all-access",
    "prereq": [],
    "effect": "The user can move through enemies. Ignores Obstruct.",
    "tags": [
      "effect:moveThroughEnemies",
      "override:obstruct"
    ]
  },
  {
    "id": "skill.pivot",
    "name": "Pivot",
    "type": "action",
    "typeGroup": "all-access",
    "prereq": [],
    "effect": "The user moves themself to the other side of an ally.",
    "tags": [
      "movement:self",
      "target:adjacentAlly"
    ]
  },
  {
    "id": "skill.reposition",
    "name": "Reposition",
    "type": "action",
    "typeGroup": "all-access",
    "prereq": [],
    "effect": "The user moves an ally to the other side of them.",
    "tags": [
      "movement:ally",
      "target:adjacentAlly"
    ]
  },
  {
    "id": "skill.swap",
    "name": "Swap",
    "type": "action",
    "typeGroup": "all-access",
    "prereq": [],
    "effect": "The user swaps places with an adjacent ally.",
    "tags": [
      "movement:self",
      "movement:ally",
      "target:adjacentAlly"
    ]
  },
  {
    "id": "skill.guard",
    "name": "Guard",
    "type": "passive",
    "typeGroup": "all-access",
    "prereq": [],
    "effect": "Opponents do not gain Charge through combat with the user.",
    "tags": [
      "effect:denyChargeToFoe"
    ]
  },
  {
    "id": "skill.solidarity",
    "name": "Solidarity",
    "type": "passive",
    "typeGroup": "all-access",
    "prereq": [
      "level:5"
    ],
    "effect": "Hit+1 and Avoid+1 to all adjacent allies.",
    "tags": [
      "aura:adjacent",
      "target:ally",
      "grant:hit:+1",
      "grant:avoid:+1"
    ],
    "statBonuses": {
      "hit": 1,
      "avoid": 1
    }
  },
  {
    "id": "skill.celerity",
    "name": "Celerity",
    "type": "passive",
    "typeGroup": "all-access",
    "prereq": [
      "level:5"
    ],
    "effect": "Permanently raise user's Movement stat by 1.",
    "tags": [
      "permanent",
      "grant:movement:+1"
    ],
    "statBonuses": {
      "mov": 1
    }
  },
  {
    "id": "skill.hp-3",
    "name": "HP +3",
    "type": "passive",
    "typeGroup": "all-access",
    "prereq": [
      "level:5"
    ],
    "effect": "Permanently raise the user's HP stat by 3.",
    "tags": [
      "permanent",
      "grant:hp:+3"
    ],
    "statBonuses": {
      "hp": 3
    }
  },
  {
    "id": "skill.attack-2",
    "name": "Attack +2",
    "type": "passive",
    "typeGroup": "all-access",
    "prereq": [
      "level:5"
    ],
    "effect": "Permanently raise the user's Attack stat by 2.",
    "tags": [
      "permanent",
      "grant:atk:+2"
    ],
    "statBonuses": {
      "atk": 2
    }
  },
  {
    "id": "skill.defense-2",
    "name": "Defense +2",
    "type": "passive",
    "typeGroup": "all-access",
    "prereq": [
      "level:5"
    ],
    "effect": "Permanently raise the user's Defense stat by 2.",
    "tags": [
      "permanent",
      "grant:def:+2"
    ],
    "statBonuses": {
      "def": 2
    }
  },
  {
    "id": "skill.luck-2",
    "name": "Luck +2",
    "type": "passive",
    "typeGroup": "all-access",
    "prereq": [
      "level:5"
    ],
    "effect": "Permanently raise the user's Luck stat by 2.",
    "tags": [
      "permanent",
      "grant:luck:+2"
    ],
    "statBonuses": {
      "luck": 2
    }
  },
  {
    "id": "skill.speed-2",
    "name": "Speed +2",
    "type": "passive",
    "typeGroup": "all-access",
    "prereq": [
      "level:5"
    ],
    "effect": "Permanently raise the user's Speed stat by 2.",
    "tags": [
      "permanent",
      "grant:spd:+2"
    ],
    "statBonuses": {
      "spd": 2
    }
  },
  {
    "id": "skill.dexterity-2",
    "name": "Dexterity +2",
    "type": "passive",
    "typeGroup": "all-access",
    "prereq": [
      "level:5"
    ],
    "effect": "Permanently raise the user's Dexterity stat by 2.",
    "tags": [
      "permanent",
      "grant:dex:+2"
    ],
    "statBonuses": {
      "dex": 2
    }
  },
  {
    "id": "skill.resistance-2",
    "name": "Resistance +2",
    "type": "passive",
    "typeGroup": "all-access",
    "prereq": [
      "level:5"
    ],
    "effect": "Permanently raise the user's Resistance stat by 2.",
    "tags": [
      "permanent",
      "grant:res:+2"
    ],
    "statBonuses": {
      "res": 2
    }
  },
  {
    "id": "skill.escape-route",
    "name": "Escape Route",
    "type": "passive",
    "typeGroup": "all-access",
    "prereq": [
      "level:10"
    ],
    "effect": "If the user is at 1/2 HP or less, they may move adjacent to any ally (user spends all of their Movement doing this). User can perform their action after moving.",
    "tags": [
      "condition:hp<=50%",
      "effect:warpToAlly",
      "target:anyAlly"
    ]
  },
  {
    "id": "skill.wings-of-mercy",
    "name": "Wings of Mercy",
    "type": "passive",
    "typeGroup": "all-access",
    "prereq": [
      "level:10"
    ],
    "effect": "If an ally is at 1/2 HP or less, the user may move adjacent to that ally (user spends all of their Movement doing this). User can perform their action after moving.",
    "tags": [
      "condition:allyHp<=50%",
      "effect:warpToAlly",
      "target:woundedAlly"
    ]
  },
  {
    "id": "skill.cancel-affinity",
    "name": "Cancel Affinity",
    "type": "passive",
    "typeGroup": "all-access",
    "prereq": [
      "level:10"
    ],
    "effect": "Both the user and the opponent ignore Weapon Triangle bonuses and penalties during combat.",
    "tags": [
      "override:weaponTriangle"
    ]
  },
  {
    "id": "skill.triangle-adept",
    "name": "Triangle Adept",
    "type": "passive",
    "typeGroup": "all-access",
    "prereq": [
      "level:10"
    ],
    "effect": "When the user has WTA, they gain Advantage on all of their attacks; when they have WTD, they take Disadvantage on all of their attacks.",
    "tags": [
      "amplify:weaponTriangle"
    ]
  },
  {
    "id": "skill.rally-offenses",
    "name": "Rally Offenses",
    "type": "action",
    "typeGroup": "all-access",
    "prereq": [
      "level:10"
    ],
    "effect": "The user gives an adjacent ally +3 Attack and +1 Hit until the start of the user's next phase. If this skill is activated, all other Rally skills that the user has may be activated on that same ally simultaneously.",
    "tags": [
      "rally",
      "target:adjacentAlly",
      "duration:userNextPhase"
    ],
    "statBonuses": {
      "atk": 3,
      "hit": 1
    }
  },
  {
    "id": "skill.rally-reflexes",
    "name": "Rally Reflexes",
    "type": "action",
    "typeGroup": "all-access",
    "prereq": [
      "level:10"
    ],
    "effect": "The user gives an adjacent ally +3 Speed and +1 Avoid until the start of the user's next phase. If this skill is activated, all other Rally skills that the user has may be activated on that same ally simultaneously.",
    "tags": [
      "rally",
      "target:adjacentAlly",
      "duration:userNextPhase"
    ],
    "statBonuses": {
      "spd": 3,
      "avoid": 1
    }
  },
  {
    "id": "skill.rally-defenses",
    "name": "Rally Defenses",
    "type": "action",
    "typeGroup": "all-access",
    "prereq": [
      "level:10"
    ],
    "effect": "The user gives an adjacent ally +2 Defense and +2 Resistance until the start of the user's next phase. If this skill is activated, all other Rally skills that the user has may be activated on that same ally simultaneously.",
    "tags": [
      "rally",
      "target:adjacentAlly",
      "duration:userNextPhase"
    ],
    "statBonuses": {
      "def": 2,
      "res": 2
    }
  },
  {
    "id": "skill.rally-movement",
    "name": "Rally Movement",
    "type": "action",
    "typeGroup": "all-access",
    "prereq": [
      "level:15"
    ],
    "effect": "The user gives an adjacent ally +1 Movement until the start of the user's next phase. If this skill is activated, all other Rally skills that the user has may be activated on that same ally simultaneously.",
    "tags": [
      "rally",
      "target:adjacentAlly",
      "duration:userNextPhase"
    ],
    "statBonuses": {
      "mov": 1
    }
  },
  {
    "id": "skill.dual-wield",
    "name": "Dual Wield",
    "type": "passive",
    "typeGroup": "all-access",
    "prereq": [
      "level:15",
      "exclusive:expertise",
      "exclusive:master-of-arms"
    ],
    "effect": "The user gains another Weapon Proficiency.",
    "tags": [
      "grant:weaponProficiency:+1"
    ]
  },
  {
    "id": "skill.hardy-bearing",
    "name": "Hardy Bearing",
    "type": "passive",
    "typeGroup": "all-access",
    "prereq": [
      "level:15"
    ],
    "effect": "Both user and foe cannot use skills that effect priority (such as Vantage, Desperation, and Quick Riposte) or frequency (such as Wary Fighter) of attack.",
    "tags": [
      "disable:prioritySkills",
      "disable:frequencySkills"
    ]
  },
  {
    "id": "skill.vantage",
    "name": "Vantage",
    "type": "passive",
    "typeGroup": "all-access",
    "prereq": [
      "level:15",
      "exclusive:brash-assault",
      "exclusive:desperation",
      "exclusive:quick-riposte"
    ],
    "effect": "If user has 1/2 or under HP, they can attack first regardless of who initiates combat.",
    "tags": [
      "condition:hp<=50%",
      "priority:attackFirst"
    ]
  },
  {